<?xml version = "1.0" encoding = "ISO-8859-1"?>

<!DOCTYPE controllers SYSTEM "dtds/controllers.dtd">

<!-- 
Controllers doc: 
https://www.openxava.org/OpenXavaDoc/docs/controllers_en.html

Default controllers included in OpenXava (you can extend from them):
https://github.com/openxava/openxava/blob/master/openxava/src/main/resources/xava/default-controllers.xml
 
Examples of controllers (from test application):
https://github.com/openxava/openxava/blob/master/openxavatest/src/main/resources/xava/controllers.xml
-->

<controllers>
    
    <!-- Environment variable:
    <env-var name="yourapp_DEFAULT_YEAR" value="2015"/> 
    -->
    
    <!-- Session object:
    <object name="yourapp_activeYear" class="java.lang.Integer" value="2015" 
    	    scope="global"/>    
    -->
    
    <!-- Controller:
    <controller name="Teacher">
    	<extends controller="Typical"/>
    	<action name="new" icon="library-plus" keystroke="Control N"
        	class="actions.CreateTeacher">
    	</action>
	</controller>    
    -->
    
    <controller name="VersionIssues">
    	<action name="new" hidden="true"
			icon="library-plus"
			class="com.yourcompany.yourapp.actions.CreateNewIssueInVersionAction"/>
	</controller>
	
	<controller name="MyCalendar">
		<extends controller="CRUD"/>
		
		<action name="new" 
			class="com.yourcompany.yourapp.actions.NewIssueFromMyCalendarAction"
			image="new.gif"
			icon="library-plus"
			keystroke="Control N"
			loses-changed-data="true">
			<set property="restoreModel" value="true"/>						
		</action>
		
		<action name="save" mode="detail"
			by-default="if-possible"
			class="com.yourcompany.yourapp.actions.SaveReturningToListAction"
			image="save.gif"
			icon="content-save"
			keystroke="Control S"/>
			
	</controller>
    
</controllers>